title	text	link
portfolio-kbm	Centraal re-integratie portfolio dossier.	https://github.com/KarelTestSpecial/portfolio-kbm
kdc-master-dashboard	Centraal dashboard voor KDC infrastructuur.	https://github.com/KarelTestSpecial/kdc-master-dashboard
aiga	AI Automation Agency core engine.	https://github.com/KarelTestSpecial/aiga
new-tab-organizer	Chrome extension dashboard met Kanban.	https://github.com/KarelTestSpecial/new-tab-organizer
youtube-rightclick	Browser extension voor media-export.	https://github.com/KarelTestSpecial/youtube-rightclick
athena-y	Core engine van Athena CMS Factory.	https://github.com/athenacmsfactory/athena-y
demo-portfolio	Athena CMS Showcase: Portfolio template.	https://github.com/athenacmsfactory/demo-portfolio
demo-consultant	Athena CMS Showcase: Consultant template.	https://github.com/athenacmsfactory/demo-consultant